{
  "schema_version": 1,
  "release": "v1.0",
  "policy": "one workflow owner per phase; invoke/reference optional specialists only after availability, provenance, license, security and overlap checks",
  "integrations": [
    {
      "id": "superpowers",
      "kind": "skill-plugin",
      "upstream": "https://github.com/obra/superpowers",
      "role": [
        "planning",
        "tdd",
        "debugging",
        "subagents",
        "review"
      ],
      "decision": "invoke",
      "license": "MIT",
      "activation": "installed-and-phase-matched",
      "verified_at": "2026-08-21"
    },
    {
      "id": "huggingface-skills",
      "kind": "skills",
      "upstream": "https://github.com/huggingface/skills",
      "role": [
        "ai-ml",
        "hub",
        "datasets",
        "models",
        "training",
        "evals",
        "papers"
      ],
      "decision": "invoke",
      "license": "Apache-2.0",
      "activation": "installed-and-ai-ml-matched",
      "verified_at": "2026-08-21"
    },
    {
      "id": "trailofbits-skills",
      "kind": "skills",
      "upstream": "https://github.com/trailofbits/skills",
      "role": [
        "security-audit",
        "context-building",
        "differential-review",
        "fuzzing"
      ],
      "decision": "invoke-reference",
      "license": "CC-BY-SA-4.0",
      "activation": "installed-and-security-matched",
      "verified_at": "2026-08-21"
    },
    {
      "id": "sentry-skills",
      "kind": "skills",
      "upstream": "https://github.com/getsentry/skills",
      "role": [
        "skill-security",
        "engineering",
        "sentry"
      ],
      "decision": "invoke-reference",
      "license": "Apache-2.0",
      "activation": "installed-and-matched",
      "verified_at": "2026-08-21"
    },
    {
      "id": "vercel-agent-skills",
      "kind": "skills",
      "upstream": "https://github.com/vercel-labs/agent-skills",
      "role": [
        "react-next-performance",
        "web-design",
        "vercel"
      ],
      "decision": "invoke",
      "license": "MIT",
      "activation": "installed-and-stack-matched",
      "verified_at": "2026-08-21"
    },
    {
      "id": "agent-browser",
      "kind": "skill-cli-mcp",
      "upstream": "https://github.com/vercel-labs/agent-browser",
      "role": [
        "browser-automation",
        "exploratory-qa",
        "a11y"
      ],
      "decision": "invoke",
      "license": "Apache-2.0",
      "activation": "installed-and-browser-fast-matched",
      "verified_at": "2026-08-21"
    },
    {
      "id": "coderabbit",
      "kind": "review-specialist",
      "upstream": "https://www.coderabbit.ai/",
      "role": [
        "code-review",
        "pr-review"
      ],
      "decision": "invoke",
      "license": "provider-managed",
      "activation": "installed-authenticated-and-review-matched",
      "verified_at": "2026-08-21"
    },
    {
      "id": "codex-security",
      "kind": "security-specialist",
      "upstream": "https://github.com/openai/",
      "role": [
        "security-scan",
        "triage",
        "threat-model",
        "attack-path",
        "fix-validation"
      ],
      "decision": "invoke",
      "license": "provider-plugin-specific",
      "activation": "installed-and-security-matched",
      "verified_at": "2026-08-21"
    },
    {
      "id": "mini-swe-agent",
      "kind": "harness",
      "upstream": "https://github.com/SWE-agent/mini-swe-agent",
      "role": [
        "minimal-coding-harness",
        "benchmark",
        "trajectory"
      ],
      "decision": "reference",
      "license": "MIT",
      "activation": "external-harness-when-useful",
      "verified_at": "2026-08-21"
    },
    {
      "id": "open-swe",
      "kind": "harness",
      "upstream": "https://github.com/langchain-ai/open-swe",
      "role": [
        "async-coding-agent",
        "isolated-sandbox",
        "subagents"
      ],
      "decision": "reference",
      "license": "MIT",
      "activation": "external-harness-when-useful",
      "verified_at": "2026-08-21"
    },
    {
      "id": "deepagents",
      "kind": "harness-library",
      "upstream": "https://github.com/langchain-ai/deepagents",
      "role": [
        "long-horizon",
        "sandbox",
        "subagents",
        "memory",
        "hitl"
      ],
      "decision": "reference",
      "license": "MIT",
      "activation": "external-harness-when-useful",
      "verified_at": "2026-08-21"
    },
    {
      "id": "pydantic-ai-harness",
      "kind": "harness-library",
      "upstream": "https://github.com/pydantic/pydantic-ai-harness",
      "role": [
        "typed-capabilities",
        "deferred-tools",
        "budgets",
        "sandbox"
      ],
      "decision": "reference",
      "license": "MIT",
      "activation": "external-harness-when-useful",
      "verified_at": "2026-08-21"
    },
    {
      "id": "inspect-ai",
      "kind": "eval-harness",
      "upstream": "https://github.com/UKGovernmentBEIS/inspect_ai",
      "role": [
        "agent-evals",
        "model-evals",
        "trajectory"
      ],
      "decision": "wrap-reference",
      "license": "MIT",
      "activation": "external-eval-when-valid",
      "verified_at": "2026-08-21"
    },
    {
      "id": "harbor",
      "kind": "eval-harness",
      "upstream": "https://github.com/laude-institute/harbor",
      "role": [
        "isolated-agent-benchmarks",
        "terminal-bench",
        "cost-traces"
      ],
      "decision": "wrap-reference",
      "license": "Apache-2.0",
      "activation": "external-eval-when-valid",
      "verified_at": "2026-08-21"
    },
    {
      "id": "openai-symphony",
      "kind": "orchestration-reference",
      "upstream": "https://github.com/openai/symphony",
      "role": [
        "isolated-task-workspaces",
        "bounded-concurrency",
        "reconciliation",
        "proof-of-work"
      ],
      "decision": "reference",
      "license": "Apache-2.0",
      "activation": "durable-orchestration-design-reference",
      "verified_at": "2026-08-21"
    },
    {
      "id": "compound-engineering",
      "kind": "workflow-plugin",
      "upstream": "https://github.com/EveryInc/compound-engineering-plugin",
      "role": [
        "planning",
        "review",
        "project-learning"
      ],
      "decision": "reference-invoke",
      "license": "verify-current-before-use",
      "activation": "optional-alternative-workflow-owner",
      "verified_at": "2026-08-21"
    },
    {
      "id": "freshtechbro-claude-design-skillstack",
      "kind": "design-skill-marketplace",
      "upstream": "https://github.com/freshtechbro/claudedesignskills",
      "role": [
        "motion",
        "interaction-design",
        "web3d",
        "creative-web",
        "design-audit"
      ],
      "decision": "absorb-reference-invoke",
      "license": "MIT",
      "activation": "installed-and-design-stack-matched",
      "verified_at": "2026-08-23"
    },
    {
      "id": "piebald-claude-code-prompts",
      "kind": "reverse-engineering-reference",
      "upstream": "https://github.com/Piebald-AI/claude-code-system-prompts",
      "role": [
        "tool-routing",
        "action-security",
        "review",
        "memory",
        "batch-worktrees",
        "simplification"
      ],
      "decision": "absorb-reference",
      "license": "MIT repository; extracted prompt provenance caution",
      "activation": "research-reference-only",
      "verified_at": "2026-08-31"
    },
    {
      "id": "gemini-cli-auto-memory",
      "kind": "agent-memory-reference",
      "upstream": "https://github.com/google-gemini/gemini-cli",
      "role": [
        "reviewed-memory-candidates",
        "skill-candidates",
        "patch-validation"
      ],
      "decision": "absorb-reference",
      "license": "Apache-2.0",
      "activation": "pattern-reference-only",
      "verified_at": "2026-08-31"
    },
    {
      "id": "qwen-code-memory",
      "kind": "agent-memory-reference",
      "upstream": "https://github.com/QwenLM/qwen-code",
      "role": [
        "auto-memory",
        "team-memory",
        "consolidation",
        "freshness-lessons"
      ],
      "decision": "absorb-reference",
      "license": "Apache-2.0",
      "activation": "pattern-reference-only",
      "verified_at": "2026-08-31"
    },
    {
      "id": "karpathy-autoresearch",
      "kind": "experiment-loop-reference",
      "upstream": "https://github.com/karpathy/autoresearch",
      "role": [
        "measurable-optimization",
        "keep-revert",
        "experiment-ledger"
      ],
      "decision": "absorb-reference",
      "license": "README labels MIT; recheck standalone license before copying",
      "activation": "pattern-reference-only",
      "verified_at": "2026-08-31"
    },
    {
      "id": "kimi-cli-hooks",
      "kind": "agent-lifecycle-reference",
      "upstream": "https://github.com/MoonshotAI/kimi-cli",
      "role": [
        "lifecycle-hooks",
        "subagents",
        "compaction-hooks",
        "policy-seams"
      ],
      "decision": "absorb-reference",
      "license": "Apache-2.0",
      "activation": "pattern-reference-only",
      "verified_at": "2026-08-31"
    },
    {
      "id": "cline-agent-runtime",
      "kind": "agent-harness-reference",
      "upstream": "https://github.com/cline/cline",
      "role": [
        "checkpoints",
        "worktrees",
        "dependency-chains",
        "headless-automation"
      ],
      "decision": "absorb-reference",
      "license": "Apache-2.0",
      "activation": "pattern-reference-only",
      "verified_at": "2026-08-31"
    },
    {
      "id": "mcpproxy-go",
      "kind": "mcp-gateway-reference",
      "upstream": "https://github.com/smart-mcp-proxy/mcpproxy-go",
      "role": [
        "deferred-tool-loading",
        "quarantine",
        "intent-routing",
        "audit"
      ],
      "decision": "absorb-reference",